{
  "$schema": "../schema/font-manifest-v2.schema.json",
  "schema_version": 2,
  "document_type": "home-visual-font-manifest",
  "cache_directory": ".visual-cache/fonts",
  "fonts": [
    {
      "family": "Pretendard",
      "weight": 400,
      "style": "normal",
      "file": "Pretendard-Regular.woff2",
      "url": "https://cdn.jsdelivr.net/gh/orioncactus/pretendard@v1.3.9/packages/pretendard/dist/web/static/woff2/Pretendard-Regular.woff2",
      "sha256": "fad853f7f47c6c8b103171e7193fa095708cdcd70850a71d93aa5379e8a61d63"
    },
    {
      "family": "Pretendard",
      "weight": 600,
      "style": "normal",
      "file": "Pretendard-SemiBold.woff2",
      "url": "https://cdn.jsdelivr.net/gh/orioncactus/pretendard@v1.3.9/packages/pretendard/dist/web/static/woff2/Pretendard-SemiBold.woff2",
      "sha256": "c863f76a7de5c1ddc1ed8b2fa794964530774592c4f31407a84e2a2ae93f17f0"
    },
    {
      "family": "Pretendard",
      "weight": 700,
      "style": "normal",
      "file": "Pretendard-Bold.woff2",
      "url": "https://cdn.jsdelivr.net/gh/orioncactus/pretendard@v1.3.9/packages/pretendard/dist/web/static/woff2/Pretendard-Bold.woff2",
      "sha256": "4609c3356e536fafe38f4add0daeceb3d8595d3057bce13c428c33ddbd43d362"
    },
    {
      "family": "D2Coding",
      "weight": 400,
      "style": "normal",
      "file": "D2Coding-Regular.woff2",
      "url": "https://cdn.jsdelivr.net/npm/d2coding@1.3.2/fonts/d2coding-subset.woff2",
      "sha256": "5d54097ce55cf1893761203191fa6795d49cab22120675b966eae1082f6f9c3c"
    }
  ]
}
